Title,Authors,Year,Citations,Journal,Link,Topic
Travel writing and transculturation,['I Eyes'],1992,519,,,EYES
"Familial multifocal fibrosclerosis: findings suggesting that retroperitoneal fibrosis, mediastinal fibrosis, sclerosing cholangitis, Riedel's thyroiditis, and pseudotumor of","['DE COMINGS', 'KB Skubi', 'J Van Eyes']",1967,464,Annals of Internal,http://annals.org/aim/fullarticle/681352/familial-multifocal-fibrosclerosis-findings-suggesting-retroperitoneal-fibrosis-mediastinal-fibrosis-sclerosing,EYES
Zora Neale Hurston's Their Eyes Were Watching God,['H Bloom'],2008,2268,,https://books.google.com/books?hl=en&lr=&id=WBNuLxTzzwMC&oi=fnd&pg=PP1&dq=EYES&ots=KByPoWO90Y&sig=bsUUBq1MvLak1iivWqCrM4WA9ZU,EYES
Imperial eyes: Travel writing and transculturation,['ML Pratt'],2007,1262,,https://books.google.com/books?hl=en&lr=&id=hot8AgAAQBAJ&oi=fnd&pg=PP1&dq=EYES&ots=QARiiHEIGv&sig=tXUqRE7h7ZSmOt-BV2p73qwXGv4,EYES
Under Western eyes: Feminist scholarship and colonial discourses,['CT Mohanty'],1988,6004,Feminist review,http://www.jstor.org/stable/1395054,EYES
Rubber hands' feel'touch that eyes see,"['M Botvinick', 'J Cohen']",1998,2470,Nature,https://www.nature.com/articles/35784.pdf?origin=ppub,EYES
"The Reading the Mind in the Eyes Test revised version: a study with normal adults, and adults with Asperger syndrome or high-functioning autism","['S Baron-Cohen', 'S Wheelwright', 'J Hill']",2001,3489,The Journal of Child,https://www.cambridge.org/core/journals/journal-of-child-psychology-and-psychiatry-and-allied-disciplines/article/the-reading-the-mind-in-the-eyes-test-revised-version-a-study-with-normal-adults-and-adults-with-asperger-syndrome-or-high-functioning-autism/269621E672E0CD4CD20C33582130A8FB,EYES
The eyes have it: A task by data type taxonomy for information visualizations,['B Shneiderman'],1996,4571,Visual Languages,http://ieeexplore.ieee.org/abstract/document/545307/,EYES
Downcast eyes: The denigration of vision in twentieth-century French thought,['M Jay'],1993,3637,,https://books.google.com/books?hl=en&lr=&id=C_vSr9mixnkC&oi=fnd&pg=PP1&dq=EYES&ots=SFrWeQsq7K&sig=YAxaSs9VDqOVHcjNK1tc2s-3Y9Q,EYES
"Movements of the Eyes, 2nd Rev",['RHS Carpenter'],1988,1923,,http://doi.apa.org/psycinfo/1988-98287-000,EYES
Biologically inspired artificial compound eyes,"['KH Jeong', 'J Kim', 'LP Lee']",2006,455,science,http://science.sciencemag.org/content/312/5773/557.short,EYES
Descemet's stripping with endothelial keratoplasty in 50 eyes: a refractive neutral corneal transplant,"['FW Price', 'MO Price']",2005,540,Journal of Refractive Surgery,https://www.healio.com/ophthalmology/journals/jrs/2005-7-21-4/%7Bd66257e8-200a-450f-a54f-5ce4a454f7d3%7D/descemets-stripping-with-endothelial-keratoplasty-in-50-eyes-a-refractive-neutral-corneal-transplant,EYES
Comparison of optic nerve imaging methods to distinguish normal eyes from those with glaucoma,"['MJ Greaney', 'DC Hoffman']",2002,489,& visual science,http://iovs.arvojournals.org/article.aspx?articleid=2122880,EYES
Through Navajo Eyes an Exploration in Film Communication and Anthropology,"['S Worth', 'J Adair']",1972,590,,https://philpapers.org/rec/WORTNE,EYES
Human visual pigments: microspectrophotometric results from the eyes of seven persons,"['HJA Dartnall', 'JK Bowmaker']",1983,495,of the Royal,http://rspb.royalsocietypublishing.org/content/220/1218/115.short,EYES
Foveal retinoschisis and retinal detachment in severely myopic eyes with posterior staphyloma,"['M Takano', 'S Kishi']",1999,336,American journal of ophthalmology,http://www.sciencedirect.com/science/article/pii/S0002939499001865,EYES
"Corneal biomechanical properties in normal, post-laser in situ keratomileusis, and keratoconic eyes","['D Ortiz', 'D Piero', 'MH Shabayek']",2007,387,Journal of Cataract &,http://www.sciencedirect.com/science/article/pii/S0886335007008279,EYES
A human homologue of the Drosophila eyes absent gene underlies branchio-oto-renal (BOR) syndrome and identifies a novel gene family,"['S Abdelhak', 'V Kalatzis', 'R Heilig', 'S Compain']",1997,562,Nature,https://www.nature.com/articles/ng0297-157,EYES
Are children with autism blind to the mentalistic significance of the eyes?,"['S BaronCohen', 'R Campbell']",1995,500,British Journal of,http://onlinelibrary.wiley.com/doi/10.1111/j.2044-835X.1995.tb00687.x/full,EYES
Attention to the eyes and fear-recognition deficits in child psychopathy,"['MR Dadds', 'Y Perry', 'DJ Hawes', 'S Merz']",2006,331,The British Journal of,http://bjp.rcpsych.org/content/189/3/280.full-text.pdf+html,EYES
Induction of ectopic eyes by targeted expression of the eyeless gene in Drosophila,"['G Halder', 'P Callaerts', 'WJ Gehring']",1995,1510,SCIENCE-NEW YORK THEN,http://www.jstor.org/stable/pdf/2886334.pdf,EYES
Through the patient's eyes: understanding and promoting patient-centered care,['M Gerteis'],1993,1170,,https://repository.library.georgetown.edu/handle/10822/860654,EYES
Increased vascular endothelial growth factor levels in the vitreous of eyes with proliferative diabetic retinopathy,"['AP Adamis', 'JW Miller', 'MT Bernal', ""DJ D'Amico""]",1994,1367,American journal of,http://www.sciencedirect.com/science/article/pii/S0002939414757940,EYES
The eyes of the skin: architecture and the senses,['J Pallasmaa'],2012,1755,,https://books.google.com/books?hl=en&lr=&id=VXUxwHx9wlQC&oi=fnd&pg=PA4&dq=EYES&ots=ZVWl-Hue8W&sig=Zgr52Z5ySHHFuMoQ2rNPQodNAXA,EYES
Under Western eyes: Feminist scholarship and colonial discourses,['CT Mohanty'],1984,1475,Boundary 2,http://www.jstor.org/stable/302821,EYES
Report of the National Eye Institute/Industry Workshop on clinical trials in dry eyes,['A Lemp'],1995,1645,Eye & Contact Lens,http://journals.lww.com/claojournal/citation/1995/21040/report_of_the_national_eye_institute_industry.3.aspx,EYES
The eyes have it! Reflexive orienting is triggered by nonpredictive gaze,"['CK Friesen', 'A Kingstone']",1998,1059,Psychonomic bulletin & review,http://www.springerlink.com/index/YX7539P40846886J.pdf,EYES
The light in their eyes: Creating multicultural learning communities,['S Nieto'],2015,1734,,https://books.google.com/books?hl=en&lr=&id=xKVDAwAAQBAJ&oi=fnd&pg=PT10&dq=EYES&ots=0GkU0EAVLM&sig=l4LaOdxckMLi7oUaDWi0vNfK0gQ,EYES
Hostility in takeovers: in the eyes of the beholder?,['GW Schwert'],2000,987,The Journal of Finance,http://onlinelibrary.wiley.com/doi/10.1111/0022-1082.00301/full,EYES
Retinal ganglion cell atrophy correlated with automated perimetry in human eyes with glaucoma,"['HA Quigley', 'GR Dunkelberger', 'WR Green']",1989,1160,American journal of,http://www.sciencedirect.com/science/article/pii/0002939489904881,EYES
