Title,Authors,Year,Citations,Journal,Link,Topic
Resistance switching memories are memristors,['L Chua'],2014,768,Memristor Networks,http://link.springer.com/chapter/10.1007/978-3-319-02630-5_3,MEMRISTORS
"Circuit elements with memory: memristors, memcapacitors, and meminductors","['M Di Ventra', 'YV Pershin', 'LO Chua']",2009,615,Proceedings of the IEEE,http://ieeexplore.ieee.org/abstract/document/5247127/,MEMRISTORS
Practical approach to programmable analog circuits with memristors,"['YV Pershin', 'M Di Ventra']",2010,418,on Circuits and Systems I: Regular,http://ieeexplore.ieee.org/abstract/document/5405039/,MEMRISTORS
Exponential ionic drift: fast switching and low volatility of thin-film memristors,"['DB Strukov', 'RS Williams']",2009,377,Applied Physics A: Materials Science &,http://www.springerlink.com/index/G671774418V0U312.pdf,MEMRISTORS
On SPICE macromodelling of TiO2 memristors,"['S Benderli', 'TA Wey']",2009,188,Electronics letters,http://ieeexplore.ieee.org/abstract/document/4807029/,MEMRISTORS
Training and operation of an integrated neuromorphic network based on metal-oxide memristors,"['M Prezioso', 'F Merrikh-Bayat', 'BD Hoskins', 'GC Adam']",2015,400,Nature,https://www.nature.com/nature/journal/v521/n7550/abs/nature14441.html,MEMRISTORS
A scalable neuristor built with Mott memristors,"['MD Pickett', 'G Medeiros-Ribeiro', 'RS Williams']",2013,244,Nature materials,https://www.nature.com/nmat/journal/v12/n2/abs/nmat3510.html,MEMRISTORS
Two centuries of memristors,['T Prodromakis'],2013,159,Chaos,http://www.worldscientific.com/doi/abs/10.1142/9789814434805_0041,MEMRISTORS
Compact models for memristors based on charge-flux constitutive relationships,"['S Shin', 'K Kim', 'SM Kang']",2010,179,IEEE Transactions on Computer,http://ieeexplore.ieee.org/abstract/document/5433745/,MEMRISTORS
CNN using memristors for neighborhood connections,"['E Lehtonen', 'M Laiho']",2010,131,Cellular Nanoscale Networks and Their,http://ieeexplore.ieee.org/abstract/document/5430304/,MEMRISTORS
Stateful implication logic with memristors,"['E Lehtonen', 'M Laiho']",2009,117,Proceedings of the 2009 IEEE/ACM International,http://dl.acm.org/citation.cfm?id=1936814,MEMRISTORS
Writing to and reading from a nano-scale crossbar memory based on memristors,"['PO Vontobel', 'W Robinett', 'PJ Kuekes']",2009,194,,http://iopscience.iop.org/article/10.1088/0957-4484/20/42/425204/meta,MEMRISTORS
Engineering nonlinearity into memristors for passive crossbar applications,"['J Joshua Yang', 'MX Zhang', 'MD Pickett']",2012,165,Applied Physics,http://aip.scitation.org/doi/abs/10.1063/1.3693392,MEMRISTORS
SPICE modeling of memristors,"['H Abdalla', 'MD Pickett']",2011,146,Circuits and Systems (ISCAS),http://ieeexplore.ieee.org/abstract/document/5937942/,MEMRISTORS
Two memristors suffice to compute all Boolean functions,"['E Lehtonen', 'JH Poikonen', 'M Laiho']",2010,70,Electronics letters,http://ieeexplore.ieee.org/abstract/document/5410671/,MEMRISTORS
Solving mazes with memristors: A massively parallel approach,"['YV Pershin', 'M Di Ventra']",2011,116,Physical Review E,https://journals.aps.org/pre/abstract/10.1103/PhysRevE.84.046703,MEMRISTORS
Nanoparticle assemblies as memristors,"['TH Kim', 'EY Jang', 'NJ Lee', 'DJ Choi', 'KJ Lee', 'J Jang']",2009,136,Nano,http://pubs.acs.org/doi/abs/10.1021/nl900030n,MEMRISTORS
STDP and STDP variations with memristors for spiking neuromorphic learning systems,"['T Serrano-Gotarredona', 'T Masquelier']",2013,145,Frontiers in,http://www.mdpi.com/article/10.3389/fnins.2013.00002,MEMRISTORS
"Putting memory into circuit elements: memristors, memcapacitors, and meminductors [point of view]","['M Di Ventra', 'YV Pershin', 'LO Chua']",2009,69,Proceedings of the IEEE,http://ieeexplore.ieee.org/abstract/document/5109686/,MEMRISTORS
HodgkinHuxley axon is made of memristors,"['L Chua', 'V Sbitnev', 'H Kim']",2012,107,International Journal of Bifurcation and,http://www.worldscientific.com/doi/abs/10.1142/S021812741230011X,MEMRISTORS
Memristors and memristive systems,['R Tetzlaff'],2013,68,,http://link.springer.com/content/pdf/10.1007/978-1-4614-9068-5.pdf,MEMRISTORS
"Pinched hysteretic loops of ideal memristors, memcapacitors and meminductors must be 'self-crossing'","['D Biolek', 'Z Biolek', 'V Biolkova']",2011,78,Electronics letters,http://digital-library.theiet.org/content/journals/10.1049/el.2011.2913,MEMRISTORS
Measuring the switching dynamics and energy efficiency of tantalum oxide memristors,"['JP Strachan', 'AC Torrezan', 'G Medeiros-Ribeiro']",2011,85,,http://iopscience.iop.org/article/10.1088/0957-4484/22/50/505402/meta,MEMRISTORS
Continuous Electrical Tuning of the Chemical Composition of TaOx-Based Memristors,"['F Miao', 'W Yi', 'I Goldfarb', 'JJ Yang', 'MX Zhang']",2012,91,ACS,http://pubs.acs.org/doi/abs/10.1021/nn2044577,MEMRISTORS
On the mathematical modeling of memristors,"['AG Radwan', 'MA Zidan']",2010,68,(ICM),http://ieeexplore.ieee.org/abstract/document/5696139/,MEMRISTORS
Two-terminal resistive switches (memristors) for memory and logic applications,"['W Lu', 'KH Kim', 'T Chang', 'S Gaba']",2011,80,Proceedings of the 16th Asia and,http://dl.acm.org/citation.cfm?id=1950868,MEMRISTORS
Spectromicroscopy of tantalum oxide memristors,"['JP Strachan', 'G Medeiros-Ribeiro', 'JJ Yang']",2011,73,Applied Physics,http://aip.scitation.org/doi/abs/10.1063/1.3599589,MEMRISTORS
Thermophoresis/diffusion as a plausible mechanism for unipolar resistive switching in metaloxidemetal memristors,"['DB Strukov', 'F Alibart', 'RS Williams']",2012,81,Applied Physics A,http://link.springer.com/article/10.1007/s00339-012-6902-x,MEMRISTORS
Geometry variations analysis of TiO 2 thin-film and spintronic memristors,"['M Hu', 'H Li', 'Y Chen', 'X Wang', 'RE Pino']",2011,64,Proceedings of the 16th Asia and,http://dl.acm.org/citation.cfm?id=1950820,MEMRISTORS
"Memristors: devices, models, and applications","['P Mazumder', 'SM Kang']",2012,74,Proceedings of the,https://pdfs.semanticscholar.org/3bb4/15c80ebfa0f4a0c4fa4d5606a28f5cf50b5a.pdf,MEMRISTORS
Neural learning circuits utilizing nano-crystalline silicon transistors and memristors,"['KD Cantley', 'A Subramaniam']",2012,75,IEEE transactions on,http://ieeexplore.ieee.org/abstract/document/6144768/,MEMRISTORS
State dynamics and modeling of tantalum oxide memristors,"['JP Strachan', 'AC Torrezan', 'F Miao']",2013,72,on Electron Devices,http://ieeexplore.ieee.org/abstract/document/6542012/,MEMRISTORS
"Reliable SPICE simulations of memristors, memcapacitors and meminductors","['D Biolek', 'M Di Ventra', 'YV Pershin']",2013,80,arXiv preprint arXiv:1307.2717,https://arxiv.org/abs/1307.2717,MEMRISTORS
Everything you wish to know about memristors but are afraid to ask,['C Leon'],2015,68,Radioengineering,https://www.radioeng.cz/fulltexts/2015/15_02_0319_0368.pdf,MEMRISTORS
VTEAM: A general model for voltage-controlled memristors,"['S Kvatinsky', 'M Ramadan', 'EG Friedman']",2015,72,IEEE Transactions on,http://ieeexplore.ieee.org/abstract/document/7110565/,MEMRISTORS
Proposal for memristors in signal processing,['B Mouttet'],2008,36,International Conference on Nano-Networks,http://link.springer.com/chapter/10.1007/978-3-642-02427-6_3,MEMRISTORS
Slime mould memristors,"['E Gale', 'A Adamatzky', 'B de Lacy Costello']",2015,54,BioNanoScience,http://link.springer.com/article/10.1007/s12668-014-0156-3,MEMRISTORS
Storage of electrical information in metalorganicframework memristors,"['SM Yoon', 'SC Warren']",2014,57,Angewandte Chemie,http://onlinelibrary.wiley.com/doi/10.1002/anie.201309642/full,MEMRISTORS
Switching mechanisms in microscale memristors,"['T Prodromakis', 'K Michelakis', 'C Toumazou']",2010,38,Electronics letters,http://ieeexplore.ieee.org/abstract/document/5395572/,MEMRISTORS
Delayed switching in memristors and memristive systems,"['FZ Wang', 'N Helian', 'S Wu', 'MG Lim']",2010,41,IEEE Electron,http://ieeexplore.ieee.org/abstract/document/5482202/,MEMRISTORS
Brains are made of memristors,"['MP Sah', 'H Kim', 'LO Chua']",2014,54,IEEE Circuits and Systems,http://ieeexplore.ieee.org/abstract/document/6744690/,MEMRISTORS
Cellular nanoscale network cell with memristors for local implication logic and synapses,"['M Laiho', 'E Lehtonen']",2010,41,Circuits and Systems (ISCAS),http://ieeexplore.ieee.org/abstract/document/5537188/,MEMRISTORS
Nitride memristors,"['BJ Choi', 'JJ Yang', 'MX Zhang', 'KJ Norris', 'DAA Ohlberg']",2012,44,Applied Physics A,http://link.springer.com/article/10.1007/s00339-012-7052-x,MEMRISTORS
Self-adaptive write circuit for low-power and variation-tolerant memristors,"['KH Jo', 'CM Jung', 'KS Min']",2010,39,IEEE Transactions on,http://ieeexplore.ieee.org/abstract/document/5482157/,MEMRISTORS
Biorealistic implementation of synaptic functions with oxide memristors through internal ionic dynamics,"['C Du', 'W Ma', 'T Chang', 'P Sheridan']",2015,63,Advanced Functional,http://onlinelibrary.wiley.com/doi/10.1002/adfm.201501427/full,MEMRISTORS
Twoand ThreeTerminal Resistive Switches: NanometerScale Memristors and Memistors,"['Q Xia', 'MD Pickett', 'JJ Yang', 'X Li', 'W Wu']",2011,43,Advanced Functional,http://onlinelibrary.wiley.com/doi/10.1002/adfm.201100180/full,MEMRISTORS
Lognormal switching times for titanium dioxide bipolar memristors: origin and resolution,"['G Medeiros-Ribeiro', 'F Perner', 'R Carter']",2011,50,,http://iopscience.iop.org/article/10.1088/0957-4484/22/9/095702/meta,MEMRISTORS
Memristors and Bernoulli dynamics,"['EM Drakakis', 'SN Yaliraki']",2010,38,Nanoscale Networks and,http://ieeexplore.ieee.org/abstract/document/5430324/,MEMRISTORS
Memristive-biosensors: A new detection method by using nanofabricated memristors,"['S Carrara', 'D Sacchetto', 'MA Doucey']",2012,49,Sensors and Actuators B,http://www.sciencedirect.com/science/article/pii/S0925400512004583,MEMRISTORS
A note on memristors,['G Oster'],1974,32,IEEE Transactions on Circuits and Systems,http://ieeexplore.ieee.org/abstract/document/1083778/,MEMRISTORS
FPGA based on integration of memristors and CMOS devices,"['W Wang', 'TT Jing', 'B Butcher']",2010,41,Circuits and Systems (ISCAS),http://ieeexplore.ieee.org/abstract/document/5537010/,MEMRISTORS
Fabrication and electrical characteristics of memristors with TiO2/TiO2+x active layers,"['T Prodromakis', 'K Michelakis']",2010,31,Circuits and systems,http://ieeexplore.ieee.org/abstract/document/5537379/,MEMRISTORS
MoNETA: A mind made from memristors,"['M Versace', 'B Chandler']",2010,45,IEEE Spectrum,,MEMRISTORS
Memristors can implement fuzzy logic,"['M Klimo', 'O Such']",2011,32,arXiv preprint arXiv:1110.2074,https://arxiv.org/abs/1110.2074,MEMRISTORS
Drop-coated titanium dioxide memristors,"['E Gale', 'R Mayne', 'A Adamatzky']",2014,36,Materials Chemistry and,http://www.sciencedirect.com/science/article/pii/S0254058413006810,MEMRISTORS
Dynamics analysis of chaotic circuit with two memristors,"['BC Bao', 'GD Shi', 'JP Xu', 'Z Liu', 'SH Pan']",2011,34,Science China Technological,http://link.springer.com/article/10.1007/s11431-011-4400-6,MEMRISTORS
"TiO2-based memristors and ReRAM: materials, mechanisms and models (a review)",['E Gale'],2014,48,Semiconductor Science and Technology,http://iopscience.iop.org/article/10.1088/0268-1242/29/10/104004/meta,MEMRISTORS
SPICE modeling of memristors with multilevel resistance states,"['F Xu-Dong', 'T Yu-Hua', 'W Jun-Jie']",2012,35,Chinese Physics B,http://iopscience.iop.org/article/10.1088/1674-1056/21/9/098901/meta,MEMRISTORS
A scalable neural chip with synaptic electronics using CMOS integrated memristors,"['JM Cruz-Albrecht', 'T Derosier', 'N Srinivasa']",2013,37,Nanotechnology,http://iopscience.iop.org/article/10.1088/0957-4484/24/38/384011/meta,MEMRISTORS
Resistive computing: Memristors-enabled signal multiplication,"['S Shin', 'K Kim', 'SM Kang']",2013,34,on Circuits and Systems I: Regular,http://ieeexplore.ieee.org/abstract/document/6495499/,MEMRISTORS
