Title,Authors,Year,Citations,Journal,Link,Topic
Vogel's textbook of practical organic chemistry,['BS Furniss'],1989,1144,,,TEXTBOOK
Textbook of pollen analysis,"['K Faegri', 'PE Kaland', 'K Krzywinski']",1989,7426,,https://www.cabdirect.org/cabdirect/abstract/19930670810,TEXTBOOK
Heat and thermodynamics: an intermediate textbook,"['MW Zemansky', 'RH Dittman']",1968,2009,,http://lituoso.ru/kekoci.pdf,TEXTBOOK
Guyton and Hall Textbook of Medical Physiology E-Book,['JE Hall'],2015,2106,,https://books.google.com/books?hl=en&lr=&id=krLSCQAAQBAJ&oi=fnd&pg=PP1&dq=TEXTBOOK&ots=ZChUmxKITX&sig=8Tw9yI0vek-BKH2xzqxefieYac8,TEXTBOOK
Textbook of work physiology: physiological bases of exercise,['PO strand'],2003,9994,,https://books.google.com/books?hl=en&lr=&id=BC9SiAsUPqsC&oi=fnd&pg=PR5&dq=TEXTBOOK&ots=8XXKZ3oqWl&sig=Nk_ciTDxtHFYJWiZRaWcec317eo,TEXTBOOK
Braunwald's Heart Disease E-Book: A Textbook of Cardiovascular Medicine,"['RO Bonow', 'DL Mann', 'DP Zipes', 'P Libby']",2011,6538,,https://books.google.com/books?hl=en&lr=&id=b5wADkB9oDoC&oi=fnd&pg=PP1&dq=TEXTBOOK&ots=VlTf_egDDm&sig=f_vjMtuEHXn0-4Zg6KfQ5OkkfnE,TEXTBOOK
Nelson Textbook of Pediatrics E-Book,"['RM Kliegman', 'RE Behrman', 'HB Jenson', 'BMD Stanton']",2007,7598,,,TEXTBOOK
A textbook of translation,['P Newmark'],1988,7715,,http://www.academia.edu/download/45828515/A_Textbook_of_Translation_by_Peter_Newmark.pdf,TEXTBOOK
Textbook of polymer science,['FW Billmeyer'],1971,4037,,http://agris.fao.org/agris-search/search.do?recordID=US201300468187,TEXTBOOK
A textbook of oral pathology,"['WG Shafer', 'BM MK Levy']",1983,5272,,,TEXTBOOK
Textbook of histology,"['W Bloom', 'DW Fawcett', 'AA Maximow']",1962,3334,,http://agris.fao.org/agris-search/search.do?recordID=US201300585979,TEXTBOOK
Textbook of wood technology,"['AJ Panshin', 'C Zeeuw']",1980,2666,,https://www.cabdirect.org/cabdirect/abstract/19810669130,TEXTBOOK
Chemometrics: a textbook,"['DL Massart', 'BGM Vandeginste', 'SN Deming', 'Y Michotte']",1988,2573,,,TEXTBOOK
Textbook of clinical chemistry,['BD Andresen'],1986,1447,,,TEXTBOOK
Koneman's color atlas and textbook of diagnostic microbiology,['WC Winn'],2006,1316,,https://books.google.com/books?hl=en&lr=&id=4gWwsEiMwu8C&oi=fnd&pg=PA1&dq=TEXTBOOK&ots=1QOZdInUdX&sig=SIw1HI4OnzU9iS2bMS0nN3nBtOA,TEXTBOOK
Williams textbook of endocrinology,['S Melmed'],2016,3519,,https://books.google.com/books?hl=en&lr=&id=YZ8_CwAAQBAJ&oi=fnd&pg=PP1&dq=TEXTBOOK&ots=MfXNz6ohsy&sig=SKkd35v1bPm3wxI4atcxc3-n-Sg,TEXTBOOK
Vogels textbook of quantitative chemical analysis,['J Mendham'],2006,3444,,,TEXTBOOK
Human cognitive neuropsychology: A textbook with readings,"['AW Ellis', 'AW Young']",2013,1827,,https://books.google.com/books?hl=en&lr=&id=vq-187vgIJYC&oi=fnd&pg=PP1&dq=TEXTBOOK&ots=53x2srFQvL&sig=gb4GSoDfYxODGqMM9RijSOdskJg,TEXTBOOK
Textbook of physical chemistry,['S Glasstone'],1951,2374,,http://cds.cern.ch/record/381437,TEXTBOOK
A textbook of soil chemical analysis,"['PR Hesse', 'PR Hesse']",1971,1947,,https://www.cambridge.org/core/services/aop-cambridge-core/content/view/S0014479700005202,TEXTBOOK
"Rook's Textbook of Dermatology, 4 Volume Set","['C Griffiths', 'J Barker', 'T Bleiker', 'R Chalmers', 'D Creamer']",2016,3331,,https://books.google.com/books?hl=en&lr=&id=EyypCwAAQBAJ&oi=fnd&pg=PR3&dq=TEXTBOOK&ots=g-GI3L0YdH&sig=vHomozQm-y0i4wgwT4Uao6rFLgI,TEXTBOOK
Stach's textbook of coal petrology,['E Stach'],1982,1919,,https://www.schweizerbart.de/publications/detail/isbn/9783443010188/Stach_Textbook_of_Coal_Petrology_3rd,TEXTBOOK
Textbook of Veterinary Anatomy-E-Book,"['KM Dyce', 'WO Sack', 'CJG Wensing']",2009,1420,,https://books.google.com/books?hl=en&lr=&id=Hb1BXjgb0McC&oi=fnd&pg=PT96&dq=TEXTBOOK&ots=al3d1p8u-5&sig=2ZeWScz3AJDp8U7yb37o8-JJowg,TEXTBOOK
Tietz textbook of clinical chemistry and molecular diagnostics-e-book,"['CA Burtis', 'ER Ashwood', 'DE Bruns']",2012,2173,,https://books.google.com/books?hl=en&lr=&id=BBLRUI4aHhkC&oi=fnd&pg=PP1&dq=TEXTBOOK&ots=C3kAITijuP&sig=75lrTHpdUBuEyuy0-caiorExWxY,TEXTBOOK
Fitting the task to the man: a textbook of occupational ergonomics,['E Grandjean'],1989,1967,,http://dl.acm.org/citation.cfm?id=76694,TEXTBOOK
Plant communities: a textbook of plant synecology,['R Daubenmire'],1968,1563,Plant communities: a textbook of plant synecology.,https://www.cabdirect.org/cabdirect/abstract/19686605334,TEXTBOOK
The politics of the textbook,"['M Apple', 'L Christian-Smith']",2017,1107,,https://books.google.com/books?hl=en&lr=&id=CKk0DwAAQBAJ&oi=fnd&pg=PT5&dq=TEXTBOOK&ots=VeNluNKezk&sig=50ZwnRGH15d3FS4yJFwQp0QTYrg,TEXTBOOK
Textbook of radiotherapy,['GH Fletcher'],1973,1057,,,TEXTBOOK
Lies my teacher told me: Everything your American history textbook got wrong,['JW Loewen'],2008,2365,,https://books.google.com/books?hl=en&lr=&id=5m2_xeJ4VdwC&oi=fnd&pg=PR5&dq=TEXTBOOK&ots=PA_ttodVpn&sig=xqPENdXNz7GqUf-wZG1mTXboCXA,TEXTBOOK
Textbook of Pharmacology,"['WC Bowman', 'MJ Rand']",1980,1280,,https://www.cabdirect.org/cabdirect/abstract/19810886990,TEXTBOOK
Park's textbook of preventive and social medicine,['K Park'],2007,2069,,,TEXTBOOK
A textbook of histology,"['AA Maximow', 'W Bloom']",1948,1316,A textbook of histology.,https://www.cabdirect.org/cabdirect/abstract/19520400654,TEXTBOOK
Textbook of psychiatry,"['E Bleuler', 'AA Brill']",1924,1501,,http://psycnet.apa.org/psycinfo/1924-10376-000,TEXTBOOK
Textbook of limnology,"['GA Cole', 'PE Weihe']",2015,1117,,https://books.google.com/books?hl=en&lr=&id=9ylRCwAAQBAJ&oi=fnd&pg=PR3&dq=TEXTBOOK&ots=sQtrKM2KEB&sig=W-voWVXvI1huTjEtdAlOeXyzBZU,TEXTBOOK
Oxford textbook of psychiatry,"['M Gelder', 'D Gath', 'R Mayou']",1989,974,,http://psycnet.apa.org/psycinfo/1989-98262-000,TEXTBOOK
"Textbook of Neonatal Resuscitation, (Spanish)","['J Kattwinkel', 'American Academy of Pediatrics']",2017,905,,http://ebooks.aappublications.org/book/textbook-of-neonatal-resuscitation-6th-edition-spanish,TEXTBOOK
A heat transfer textbook,['JH Lienhard'],2013,2117,,https://books.google.com/books?hl=en&lr=&id=HM7DAgAAQBAJ&oi=fnd&pg=PP1&dq=TEXTBOOK&ots=-__h110NFg&sig=JVSi1p5blfauMgrCHJaeBeoe7k0,TEXTBOOK
Comprehensive textbook of psychiatry,"['BJ Sadock', 'VA Sadock', 'P Ruiz']",2000,2223,,https://www.researchgate.net/profile/Richard_Loewenstein/publication/292985195_Dissociative_Disorders/links/56b41b1308ae5deb2657ec40/Dissociative-Disorders.pdf,TEXTBOOK
Oxford textbook of medicine,"['DA Warrell', 'TM Cox', 'JD Firth', 'EJ Benz']",2003,838,,https://academic.oup.com/heapro/issue-pdf/2/1/1822328,TEXTBOOK
Brunner & Suddarth's textbook of medical-surgical nursing,['LS Brunner'],2010,2434,,https://books.google.com/books?hl=en&lr=&id=SmtjSD1x688C&oi=fnd&pg=PA1311&dq=TEXTBOOK&ots=cjj5jf0SaS&sig=cfVsqv4z7LTwk8YMikJ7LQAIW1E,TEXTBOOK
Wall & Melzack's Textbook of Pain E-Book,"['SB McMahon', 'M Koltzenburg', 'I Tracey', 'D Turk']",2013,1719,,https://books.google.com/books?hl=en&lr=&id=ok0_jIJ0w_wC&oi=fnd&pg=PP1&dq=TEXTBOOK&ots=HiwzwtxJFH&sig=hAYdVtQjjiTcPh2gT-KcU1uIGmw,TEXTBOOK
Textbook and color atlas of traumatic injuries to the teeth,"['JO Andreasen', 'FM Andreasen', 'L Andersson']",2013,1965,,https://books.google.com/books?hl=en&lr=&id=YTQeUGZtqx4C&oi=fnd&pg=PT7&dq=TEXTBOOK&ots=oHg5T7qVWz&sig=QNApfMkpXPKLbaDJqUx89nGljdo,TEXTBOOK
"Slope stability computations: In Embankment-dam Engineering. Textbook. Eds. RC Hirschfeld and SJ Poulos. JOHN WILEY AND SONS INC., PUB., NY",['N Janbu'],1975,767,International Journal of Rock Mechanics and Mining,,TEXTBOOK
Textbook: Design and Analysis of Experiments,['DC Montgomery'],2014,1252,,http://www.stt.msu.edu/academics/classpages/uploads/FS14/801-1/STT%20801.pdf,TEXTBOOK
Substance abuse: A comprehensive textbook,['JH Lowinson'],2005,493,,https://books.google.com/books?hl=en&lr=&id=HtGb2wNsgn4C&oi=fnd&pg=PR7&dq=TEXTBOOK&ots=jol2mluXTI&sig=Wo0tsaoJnoYOBUhNVbEzhepexvs,TEXTBOOK
Imms' General Textbook of Entomology: Volume 2: Classification and Biology,"['OW Richards', 'RG Davies']",2013,1604,,https://books.google.com/books?hl=en&lr=&id=BObsCAAAQBAJ&oi=fnd&pg=PR1&dq=TEXTBOOK&ots=bewZorx0Hv&sig=Wjqo9QjKaNwjwMwaiL9pzbEfLKI,TEXTBOOK
Textbook of dendrology,"['WM Harlow', 'ES Harrar']",1941,977,,http://krishikosh.egranth.ac.in/bitstream/1/22461/1/SVAC-716.pdf,TEXTBOOK
Sabiston Textbook of Surgery E-Book,"['CM Townsend', 'RD Beauchamp', 'BM Evers', 'KL Mattox']",2016,1473,,https://books.google.com/books?hl=en&lr=&id=KYstDAAAQBAJ&oi=fnd&pg=PP1&dq=TEXTBOOK&ots=I7J4jkGsGz&sig=aHkvsK4JmTrsGJZ2YLIssyi1YgQ,TEXTBOOK
Wilson and Gisvold's textbook of organic medicinal and pharmaceutical chemistry,"['CO Wilson', 'JM Beale', 'JH Block']",2011,626,,http://dl.kums.ac.ir/handle/Hannan/6398,TEXTBOOK
Textbook of endocrinology,"['H Selye', 'BA Houssay']",1947,745,,https://academic.oup.com/endo/issue-pdf/43/1/8792917,TEXTBOOK
